{
  "updatePathOptions": {
    "rootDirectory": "./",
    "ignorePatterns": [
      "/samples/",
      "\\samples\\"
    ]
  },
  "loggingOptions": {
    "logLevel": "Verbose",
    "outputFile": "./code-updater-output.txt"
  },
  "cSharpOptions": {
    "csProjVersioningOptions": {
      "treatWarningsAsErrors": true,
      "targetFramework": "net8.0",
      "langVersion": "latest"
    },
    "csProjDotNetAnalyzerOptions": {
      "enableNetAnalyzers": true,
      "enforceCodeStyleInBuild": true
    },
    "cSharpStyleOptions": {
      "runDotnetFormat": true
    },
    "nugetOptions": {
      "auditOptions": {
        "nuGetAudit": true,
        "auditMode": "all",
        "auditLevel": "low"
      },
      "updateOptions": {
        "updateTopLevelNugetsInCsProj": true,
        "updateTopLevelNugetsNotInCsProj": true,
        "packagesToSkip": [ "Serilog" ]
      }
    }
  },
  "npmOptions": {
    "compileOptions": {
      "buildCommand": "publish"
    }
  },
  "regexSearchOptions": {
    "searches": [
      {
        "searchRegex": "[0-9]{1,2}\\..+\\.x",
        "description": "YAML Dotnet Version"
      }
    ]
  }
}